{
  "$schema": "https://json-schema.org/draft/2020-12/schema",
  "$id": "CourseMaterial.json",
  "title": "CourseMaterial",
  "description": "Public-facing course material metadata returned by the materials listing endpoint.",
  "type": "object",
  "additionalProperties": false,
  "required": [
    "canvasFileId",
    "courseId",
    "displayName",
    "contentType",
    "sizeBytes",
    "updatedAt"
  ],
  "properties": {
    "canvasFileId": { "type": "string", "minLength": 1 },
    "courseId": { "type": "string", "minLength": 1 },
    "displayName": { "type": "string", "minLength": 1 },
    "contentType": { "type": "string", "minLength": 1 },
    "sizeBytes": { "type": "integer", "minimum": 0 },
    "updatedAt": {
      "type": "string",
      "format": "date-time",
      "pattern": "^[0-9]{4}-[0-9]{2}-[0-9]{2}T[0-9]{2}:[0-9]{2}:[0-9]{2}Z$"
    }
  }
}
